{
    "id": "chelax_bureaucracy",
    "name": "Бюрократия Челии (House Thrune)",
    "type": "government",
    "description": "Имперская бюрократия Челии (House Thrune), правящая из Весткроуна (Westcrown). После смерти бога и гражданской войны к власти пришёл Дом Трун, заключивший договор с Девятью Преисподними. Бюрократия насаждает дьяволопоклонничество (Асмодей, Law) как государственную религию. Все граждане обязаны платить дань и почитать Асмодея. Поклонение любым другим богам/демонам/дьяволам — запрещено под угрозой пыток и казни. КУЛЬТ ДАГОНА — запрещённая ересь (в отличие от законного дьяволопоклонства Асмодея).",
    "members": [],
    "leader": null,
    "location": "chelax_bureaucracy",
    "secret": "Бюрократия не знает о культе Асмодея в таверне; считает дьяволопоклонничество законным, но следит за ересями (почитание иных богов). В Челии НЕТ инквизиции — её роль выполняет Орден Дыбы (Order of the Rack), один из орденов Адских рыцарей (Hellknights).",
    "conflicts_with": [
        "paladin_order"
    ]
}