{
    "id": "sirena_nera_crew",
    "name": "Экипаж корабля",
    "type": "crew",
    "description": "Экипаж корабля «Чёрная Сирена» (La Sirena Nera), на котором служили Моряк и Врач (бывший судовый врач). Моряк дезертировал, украв казну.",
    "members": [
        {
            "character": "capitan",
            "role": "капитан «Чёрной Сирены»",
            "status": "active"
        },
        {
            "character": "sailor",
            "role": "матрос (бывший, дезертир)",
            "status": "left",
            "note": "Моряк — бывший матрос «Чёрной Сирены»; дезертировал, украв казну (event_002/event_003)"
        },
        {
            "character": "doctor",
            "role": "бывший судовый врач (сослуживец)",
            "status": "left",
            "note": "Врач — бывший судовый врач «Чёрной Сирены»; давно списан с корабля на берег, не состоял в текущем экипаже"
        }
    ],
    "leader": "capitan",
    "location": "chernaya_sirena",
    "secret": "Дезертирство и кража казны скрыты от большинства (известно capitan, sailor).",
    "conflicts_with": []
}
