{
    "id": "city_authority",
    "name": "Городская власть (видимая)",
    "type": "government",
    "description": "Видимая/официальная городская власть Весткроуна: лорд-мэр Абериан Арванкси (mayor) и городская стража (city_watch, доттари; Дуксотар Илтус Мартис — duxotar). Формально законная власть, но реальная сила — торговля и Совет Воров (council_of_thieves). Детектива нанимает Дуксотар (city_watch) — единственный канон-заказчик.",
    "members": [
        {
            "character": "mayor",
            "role": "лорд-мэр Весткроуна (Абериан Арванкси)",
            "status": "active"
        },
        {
            "character": "duxotar",
            "role": "Дуксотар — командир городской стражи (city_watch)",
            "status": "active"
        }
    ],
    "leader": "mayor",
    "location": "town",
    "secret": "Видимая городская власть, за которой стоит Совет Воров (council_of_thieves) — реальная сила. Дуксотар (duxotar) некомпетентен; реальная власть стражи — у 4 дуротас.",
    "conflicts_with": [
        "smugglers"
    ]
}
