{
    "id": "paladin_order",
    "name": "Орден Вечной Розы (орден из Мендева; покровитель Шелин)",
    "type": "order",
    "description": "Орден Вечной Розы — старая паладинская орден из Мендева (государство, построенное на борьбе с демонами и тёмными культами; покровитель Шелин, её эпитет «вечная роза» — символ ордена). 4692 AR (Четвёртый крестовый поход) демонопоклонники украли из храма в Мендеве реликвию ордена — ковчег с мумифицированным черепом святого; реликвия исчезла в хаосе войны и впоследствии всплыла у контрабандистов, попав к Корину Марроне как оплата за товар, а затем была подарена им Виттории Вельди (4705 AR). Реликвия оказалась в логове культа (cult_lair) под алтарём в таверне (reliquary_skull). Художник — паладин ордена (тайный агент ордена), отправленный тайно в Челию, где дьяволопоклонничество (поклонение Асмодею, Law) — государственная религия, а демоны/Дагон = ересь. Его миссия — вернуть реликвию. Покровитель Художника — ШЕЛИН (Selyon, богиня искусства/красоты, Neutral Good), но его путь — падение/извращение. Орден — это 'старые' паладины, которые считают демоническое почитание ересью; в самой Челии они не имеют легитимности.",
    "members": [
        {
            "character": "artist",
            "role": "паладин (тайный агент ордена) (тайный агент ордена); покровитель ШЕЛИН (извращённый путь)",
            "status": "active",
            "note": "Отправлен для тайной миссии: вернуть реликвию (мумифицированный череп святого), похищенную из храма в Мендеве демонопоклонниками (4692 AR) и попавшую к Корину Марроне, а затем к Виттории Вельди (4705 AR); его серия убийств — «пытки» участников Дня Гнева 23 Рова (сентября) 4710 AR; официально не имеет права на убийства в этой стране. Покровитель Шелин (Selyon), но путь — падение: извращённое удовольствие от убийств."
        }
    ],
    "leader": null,
    "location": null,
    "secret": "Реликвия ордена (мумифицированный череп святого в ковчеге) 4692 AR украдена из храма в Мендеве демонопоклонниками (Четвёртый крестовый поход); реликвия исчезла в хаосе войны, затем всплыла у контрабандистов и попала Корину Марроне как оплата за товар, а 4705 AR была им подарена Виттории Вельди. Реликвия оказалась в логове культа (cult_lair) под алтарём в таверне (reliquary_skull). Художник — серийный убийца, маскирующий охоту на культистов Дагона под правосудие; действует тайно, без разрешения на убийства (event_018). Покровитель Художника — Шелин (извращённый путь).",
    "conflicts_with": [
        "cult",
        "hellknights",
        "council_of_thieves"
    ]
}