{
    "id": "cult",
    "name": "Культ Дагона (Dagon)",
    "type": "cult",
    "description": "Культ Дагона (Dagon) — тайный КУЛЬТ ДАГОНА (демоническое, демон/Chaos/Abyss), а НЕ дьяволопоклонничество (Асмодей/Law). В Челии почитание любых демонов (в т.ч. Дагона) — ЗАПРЕЩЁНО под угрозой пыток и казни (ЕРЕСЬ), поэтому культ скрыт в подвале таверны. Дагон — демон-лорд океана, повелевающий морскими чудовищами; его цели — затопить континенты чёрной водой. Основан dead_wife. Верховная жрица (текущая) — Официантка; бывшая верховная жрица — dead_wife (мать Официантки, обучила её при жизни, см. event_019). Святилище в подвале таверны (cult_lair). Потоп в сценарии — РИТУАЛ ДАГОНА (молитва Официантки, event_016), усиленный естественным паводком реки Адивиан. Предшественник: 4573 AR «Белая Чума» (культ Сифкеш, «Путь Благодати») → создание Ордена Дыбы.",
    "members": [
        {
            "character": "waitress",
            "role": "верховная жрица (текущая)",
            "status": "active"
        },
        {
            "character": "doctor",
            "role": "последователь",
            "status": "active"
        },
        {
            "character": "dead_wife",
            "role": "бывшая верховная жрица (основатель культа)",
            "status": "dead",
            "note": "Основатель культа; обучила дочь (Официантку) при жизни; ныне призрак"
        }
    ],
    "leader": "waitress",
    "location": "cult_lair",
    "secret": "Культ Дагона — запрещённая ересь в Челии. Существование культа скрыто; культисты не знают, что Художник (паладин (тайный агент ордена) из Мендева, покровитель Шелин) охотится на них за украденную реликвию (мумифицированный череп святого, event_018). Молитва Официантки вызвала потоп (event_016) — но это НЕ доказывает, что она убийца (принцип «убийство ≠ потоп»). Река Адивиан регулярно выходит из берегов из-за таяния снегов в горах Менадор; потоп = воля Дагона + естественный паводок.",
    "conflicts_with": [
        "paladin_order",
        "chelax_bureaucracy",
        "hellknights"
    ]
}