{
    "id": "morgue",
    "name": "Морговская контора (Морг)",
    "type": "government",
    "description": "Морговская контора города — отдел Морга (morgue), где работают Доктор (doctor) и Ассистент Доктора (doctor_assistant). Ведёт вскрытия жертв серии убийств в городе, хранит отчёты о вскрытиях (autopsy_reports). Связывает Доктора и Детектива по работе (event_024): Доктор забрал отчёты о вскрытиях поработать дома (в таверне), а Детектив расследует серию.",
    "members": [
        {
            "character": "doctor",
            "role": "врач-патологоанатом (ведёт вскрытия)",
            "status": "active",
            "note": "Доктор работает в Морг и забрал отчёты о вскрытиях (autopsy_reports) поработать дома — снимает комнату в Таверне (doctor_room). event_024."
        },
        {
            "character": "doctor_assistant",
            "role": "ассистент Доктора",
            "status": "active"
        }
    ],
    "leader": null,
    "location": "morgue",
    "secret": null,
    "conflicts_with": []
}
