{
    "id": "council_of_thieves",
    "name": "Совет Воров (Council of Thieves)",
    "type": "crime",
    "description": "Совет Воров (Council of Thieves) — знаменитый и влиятельный Совет Воров Весткроуна (Westcrown), «Города Сумерек». Несмотря на видимую законную власть (city_authority: Дуксотар, Мэр), реальная сила в Весткроуне — торговля и Совет Воров, контролирующий город через торговлю и преступность. Совет — не обычная воровская гильдия, а тайное общество; большинство горожан считают его старой сказкой/мифом, и это их устраивает. Возник около 4285 AR; после соглашения с королевой Корадинной (4469 AR) перешёл от насилия к «беловоротничковой» преступности: шантаж, ростовщичество, вымогательство, контрабанда и заказные убийства. В Совет входят представители восьми знатных домов Весткроуна (старой знати). Контрабанда Моряка и Трактирщика идёт САМОСТОЯТЕЛЬНО, минуя Совет (в общак не вносят) — Совет может привлечь их к ответу за нелегальную контрабанду (не в системе = вне защиты); это объясняет, почему контрабанда долго не замечена (нет повода для Совета интересоваться чужой контрабандой). Связан с Дуксотаром (duxotar): Дуксотар — городской представитель, а Совет Воров — его фактический «верх» или противник (по сценарию).",
    "members": [
        {
            "character": "duxotar",
            "role": "связанный городской представитель (визит/доложение; фактически подчинён/противник Совета)",
            "status": "active"
        }
    ],
    "leader": "Вассиндио Дровендж (патриарх, из дома Дровендж; к 4710 AR власть ослабевает, внутри зреет революция)",
    "location": "vassindio_drovenge_office",
    "secret": "Реальная власть в Весткроуне — не городская власть (city_authority), а Совет Воров и торговля. Совет Воров — теневая структура, контролиющая город; Дуксотар (duxotar) — видимый городской представитель, но Совет Воров — его фактический «верх» или противник (в зависимости от сценария). Контрабанда Моряка/Трактирщика (smugglers) идёт САМОСТОЯТЕЛЬНО, минуя Совет (в общак не вносят) — Совет может привлечь их к ответу (не в системе = вне защиты).",
    "conflicts_with": [
        "city_authority"
    ]
}
